{
  "input": {
    "message": "28-Nov-2024 15:26:27.359 client 1.2.3.4#63175: UDP: query: www.bing.com IN A response: NOERROR + www.bing.com. 7072 IN CNAME www-www.bing.com.trafficmanager.net.; www-www.bing.com.trafficmanager.net. 56 IN CNAME www.bing.com.edgekey.net.; www.bing.com.edgekey.net. 7154 IN CNAME e86303.test.xxxxx.net.; e86303.test.xxxxx.net. 17 IN A 1.2.3.181; e86303.test.xxxxx.net. 17 IN A 1.2.3.173; e86303.test.xxxxx.net. 17 IN A 1.2.3.184; e86303.test.xxxxx.net. 17 IN A 1.2.3.185; e86303.test.xxxxx.net. 17 IN A 1.2.3.174; e86303.test.xxxxx.net. 17 IN A 1.2.3.183; e86303.test.xxxxx.net. 17 IN A 1.2.3.177; e86303.test.xxxxx.net. 17 IN A 1.2.3.179; e86303.test.xxxxx.net. 17 IN A 1.2.3.175;"
  },
  "expected": {
    "message": "28-Nov-2024 15:26:27.359 client 1.2.3.4#63175: UDP: query: www.bing.com IN A response: NOERROR + www.bing.com. 7072 IN CNAME www-www.bing.com.trafficmanager.net.; www-www.bing.com.trafficmanager.net. 56 IN CNAME www.bing.com.edgekey.net.; www.bing.com.edgekey.net. 7154 IN CNAME e86303.test.xxxxx.net.; e86303.test.xxxxx.net. 17 IN A 1.2.3.181; e86303.test.xxxxx.net. 17 IN A 1.2.3.173; e86303.test.xxxxx.net. 17 IN A 1.2.3.184; e86303.test.xxxxx.net. 17 IN A 1.2.3.185; e86303.test.xxxxx.net. 17 IN A 1.2.3.174; e86303.test.xxxxx.net. 17 IN A 1.2.3.183; e86303.test.xxxxx.net. 17 IN A 1.2.3.177; e86303.test.xxxxx.net. 17 IN A 1.2.3.179; e86303.test.xxxxx.net. 17 IN A 1.2.3.175;",
    "@timestamp": "2024-11-28T15:26:27.359000Z",
    "dns": {
      "header_flags": [],
      "question": {
        "class": "IN",
        "name": "www.bing.com",
        "registered_domain": "bing.com",
        "subdomain": "www",
        "top_level_domain": "com",
        "type": "A"
      },
      "response_code": "NOERROR",
      "type": "query"
    },
    "related": {
      "hosts": [
        "www.bing.com"
      ],
      "ip": [
        "1.2.3.4"
      ]
    },
    "source": {
      "address": "1.2.3.4",
      "ip": "1.2.3.4",
      "port": 63175
    }
  }
}